{
  "id": "f6a7b8c9-d0e1-2345-f012-3456789abcde",
  "filename": "architecture-diagram.png",
  "path": "documents/diagrams/architecture-diagram.png",
  "mime_type": "image/png",
  "size_bytes": 1048576,
  "checksum": "a1b2c3d4e5f6a7b8c9d0e1f2a3b4c5d6e7f8a9b0c1d2e3f4a5b6c7d8e9f0a1b2",
  "storage_backend": "local-fs",
  "source": "nextcloud",
  "source_id": "nc-file-555",
  "extensions": {
    "com.nextcloud.plugin": {
      "share_link": "https://cloud.example.com/s/abc123",
      "version": 3
    }
  },
  "created_at": "2026-02-10T14:00:00Z",
  "updated_at": "2026-03-23T09:00:00Z"
}
